{
  "artifact": "canonical_pipeline_v1",
  "schema_version": 1,
  "schema": "conformance/schemas/cv-canonical-pipeline-v1.json",
  "_meta": {
    "generated_by": "clients/go/cmd/gen-conformance-fixtures",
    "warning": "MACHINE-GENERATED FILE. Do not edit manually."
  },
  "authority": {
    "architecture_parent": "RUB-882 as superseded by RUB-1180",
    "baseline_ref": "2tbmz9y2xt-lang/rubin-protocol@86571857571736862e3194daa61491639cea5138",
    "consume_freeze_point": "POST-RUB-911 target: the frozen P2P effect order carries no canonical-DA consume step",
    "executors": "RUB-923, RUB-926, RUB-924, RUB-901",
    "expected_row_origin": "authored architecture authority; no Go or Rust node production path is called to compute an expected value",
    "issue": "RUB-922",
    "normative_spec_ref": "2tbmz9y2xt-lang/rubin-spec@c14b010024ce633e1027bf891af3c49741db544a",
    "status": "INERT until its adapters and comparator land; no canonical-publication slice may claim it as a passing gate"
  },
  "result_taxonomy": [
    "ACCEPTED",
    "STORED_NONCANONICAL",
    "KNOWN_BLOCK_NOOP(CANONICAL|STORED_NONCANONICAL)",
    "MISSING_PARENT",
    "ORPHAN_RETAINED",
    "ORPHAN_ALREADY_RETAINED",
    "CONSENSUS_INVALID(exact_error)",
    "LOCAL_BUSY",
    "LOCAL_RESOURCE_UNAVAILABLE(resource)",
    "STALE_LOCAL_PLAN",
    "LOCAL_CANCELLED",
    "LOCAL_STORE_ERROR(noncanonical)",
    "LOCAL_PERSISTENCE_ERROR(precommit)",
    "TERMINAL_STORE_INTEGRITY(canonical)",
    "TERMINAL_LOCAL_INVARIANT(evidence)",
    "TERMINAL_PERSISTENCE(old|new|neither_or_unreadable)"
  ],
  "commit_truth_values": [
    "OLD",
    "NEW",
    "UNKNOWN",
    "NOT_APPLICABLE"
  ],
  "coverage_receipt": {
    "accepted:coherent_capture_publication": "C01-DIRECT-001, C01-REORG-001",
    "accepted:go_resource_authority": "C01-GO-CONSTANTS-001",
    "accepted:lazy_memoized_provider": "C01-PROVIDER-001",
    "accepted:post_namespace_terminal_class": "C01-TP-OLD-001, C01-TP-NEW-001, C01-TP-UNKNOWN-001",
    "accepted:pre_namespace_index_failure": "C01-PRENS-001",
    "accepted:reorg_metadata_charge": "C01-REORGMETA-001",
    "accepted:rust_repeat_corpus": "C01-GO-CONSTANTS-001",
    "hostile:apply_plan_metadata_caps": "C01-APPLYMETA-CAP-001, C01-APPLYMETA-OVER-001",
    "hostile:canonical_ambiguity_and_readers": "C01-TP-UNKNOWN-001",
    "hostile:duplicate_and_corrupt_combinations": "C01-PRESENCE-TERMINAL-001, C01-PRESENCE-STOREERR-001, C01-NOOP-FULL-001, C01-NOOP-CMPCT-001, C01-RECLAIMED-RECEIVE-001",
    "hostile:equal_work_opposite_orders": "C01-EQUALWORK-001",
    "hostile:inbound_reservation_and_wire_errors": "C01-WIRE-OVERFLOW-001",
    "hostile:late_consensus_invalid_wins": "C01-FIRSTERR-LATE-001",
    "hostile:miner_reorg_peak_cancellation": "C01-CANCEL-001",
    "hostile:orphan_admission_eviction_refusal": "C01-ORPH-INFLIGHT-001, C01-ORPH-OVERSIZE-001, C01-ORPH-SOURCE51-001",
    "hostile:orphan_cap_boundaries_and_source_keys": "C01-ORPH-EVICT-001, C01-ORPH-SOURCE51-001, C01-SRCKEY-001",
    "hostile:paired_first_errors": "C01-FIRSTERR-INDEX-001",
    "hostile:permit_budget_races": "C01-BUSY-001, C01-BUDGET-RACE-001",
    "hostile:postcommit_fault_boundaries": "C01-FAULT-STORED-001, C01-FAULT-ACCEPTED-001",
    "hostile:quota_crash_and_reclassification": "C01-GC-ORDER-001, C01-GC-CRASH-001",
    "observable:block_seen_inventory": "C01-NOOP-CMPCT-001, C01-RECLAIMED-RECEIVE-001, C01-INVENTORY-001, C01-INVENTORY-RECLAIMED-001",
    "observable:checkpoint_rows": "C01-CKPT-001",
    "observable:counter_deltas": "C01-DIRECT-001, C01-SIDE-001, C01-REORG-001, C01-DISCONNECT-001, C01-NEUTRAL-001, C01-FIRSTERR-LATE-001",
    "observable:final_state_atomicity": "C01-REORG-001",
    "observable:frozen_effect_order": "C01-EFFECT-STORED-001, C01-EFFECT-ACCEPTED-001, C01-RELAY-STORED-001, C01-RELAY-ACCEPTED-001",
    "observable:gc_damage_order": "C01-GC-ORDER-001, C01-GC-HEALTHY-001",
    "observable:known_block_noop": "C01-NOOP-FULL-001, C01-NOOP-CMPCT-001",
    "observable:no_penalty_bounds": "C01-NEUTRAL-001",
    "observable:orphan_pool": "C01-ORPH-RETAIN-001, C01-ORPH-DUP-001, C01-ORPH-EVICT-001, C01-ORPH-INFLIGHT-001",
    "observable:p2p_precedence": "C01-PATHS-001",
    "observable:path_precedence": "C01-PATHS-001, C01-GENESIS-001, C01-FIRSTERR-INDEX-001",
    "observable:paths": "C01-PATHS-001",
    "observable:permit_retry_budget": "C01-BUSY-001, C01-BUDGET-RACE-001",
    "observable:postcommit_effects": "C01-EFFECT-STORED-001, C01-POSTCOMMIT-001, C01-RELAY-STORED-001, C01-RELAY-ACCEPTED-001",
    "observable:presence_truth_table": "C01-PRESENCE-001, C01-PRESENCE-TERMINAL-001, C01-PRESENCE-STOREERR-001",
    "observable:resource_identities": "C01-GC-HEALTHY-001, C01-RES-IDENTITIES-001, C01-RES-RECOVERY-001, C01-RES-IDENTITIES-PENDING-001",
    "observable:source_quota_key": "C01-SRCKEY-001",
    "rejected:foreign_surface_mutation": "C01-FORBID-SURFACE-001",
    "rejected:intermediate_or_duplicate_visibility": "C01-FORBID-INTERMEDIATE-001",
    "rejected:late_or_retaining_busy": "C01-FORBID-BUSY-001",
    "rejected:persistent_state_machinery": "C01-FORBID-PERSIST-001",
    "rejected:presence_authority_misuse": "C01-INVENTORY-001, C01-FORBID-PRESENCE-001",
    "rejected:retry_and_pool_shape": "C01-FORBID-RETRY-001",
    "taxonomy:ACCEPTED": "C01-DIRECT-001, C01-EFFECT-ACCEPTED-001",
    "taxonomy:CONSENSUS_INVALID": "C01-FIRSTERR-LATE-001",
    "taxonomy:KNOWN_BLOCK_NOOP": "C01-NOOP-FULL-001, C01-NOOP-CMPCT-001",
    "taxonomy:LOCAL_BUSY": "C01-BUSY-001",
    "taxonomy:LOCAL_CANCELLED": "C01-CANCEL-001",
    "taxonomy:LOCAL_PERSISTENCE_ERROR": "C01-PRENS-001",
    "taxonomy:LOCAL_RESOURCE_UNAVAILABLE": "C01-GC-HEALTHY-001, C01-RES-RECOVERY-001",
    "taxonomy:LOCAL_STORE_ERROR": "C01-PRESENCE-STOREERR-001",
    "taxonomy:MISSING_PARENT": "C01-ORPH-MISSING-PARENT-001",
    "taxonomy:ORPHAN_ALREADY_RETAINED": "C01-ORPH-DUP-001",
    "taxonomy:ORPHAN_RETAINED": "C01-ORPH-RETAIN-001",
    "taxonomy:STALE_LOCAL_PLAN": "C01-STALE-001",
    "taxonomy:STORED_NONCANONICAL": "C01-SIDE-001, C01-EFFECT-STORED-001",
    "taxonomy:TERMINAL_LOCAL_INVARIANT": "C01-TERMINV-001, C01-TERMINV-BOOT-001",
    "taxonomy:TERMINAL_PERSISTENCE": "C01-TP-OLD-001, C01-TP-NEW-001, C01-TP-UNKNOWN-001",
    "taxonomy:TERMINAL_STORE_INTEGRITY": "C01-FIRSTERR-INDEX-001"
  },
  "rows": [
    {
      "id": "C01-PATHS-001",
      "kind": "authority",
      "scenario": "Closed set of canonical-pipeline entry paths and their path-specific first-error precedence, including the exact fork choice every side path uses during branch collection.",
      "detail": {
        "compact_absent_cycle": "release_first_lease, reconstruction_or_network, reacquire_lease, repeat_strict_presence",
        "direct_or_genesis": "target, genesis_guard_when_applicable, strict_initial_canonical_index_preflight, mtp, validation",
        "fork_choice": "maximum cumulative ChainWork, then lexicographically lower canonical tip-hash bytes; independent of arrival order, worker schedule, validation completion and best-ready status",
        "losing_side": "strict_index_read_during_branch_collection, fork_choice, target, mtp, basic_validation, store_block",
        "p2p": "frame_length, frame_read, frame_checksum, documented_early_parse, header_check, pow_check, try_acquire_result, lease_owned_strict_presence, stateful_target_mtp_provider_consensus",
        "paths": "direct, genesis, losing_side, reorg, disconnect, miner, p2p_full, p2p_compact_probe, p2p_compact_reconstructed, p2p_relay_fallback, orphan_resolved",
        "reorg": "strict_index_read_during_branch_collection, fork_choice, initial_mtp_snapshot, per_connect_row_target, connect_block_with_sliding_mtp, advance_mtp"
      }
    },
    {
      "id": "C01-DIRECT-001",
      "kind": "observation",
      "scenario": "One coherent A capture, one rolling private B, one process-local capacity-1 permit and one durable canonical-index commit publish the complete chain, standard, DA and owner image with no-fail RAM publication.",
      "result": "ACCEPTED",
      "commit_truth": "NEW",
      "rpc_projection": "result-selecting mined candidate: committed with identity; bootstrap: continuation-only",
      "canonical_counters": {
        "accepted_delta": "+1",
        "rejected_delta": "0"
      }
    },
    {
      "id": "C01-GENESIS-001",
      "kind": "observation",
      "scenario": "Genesis bootstrap from the exact empty pre-genesis state; the genesis guard runs after the direct target check and before the strict initial canonical-index preflight.",
      "result": "ACCEPTED",
      "commit_truth": "NEW",
      "rpc_projection": "bootstrap: continuation-only",
      "canonical_counters": {
        "accepted_delta": "+1",
        "rejected_delta": "0"
      }
    },
    {
      "id": "C01-SIDE-001",
      "kind": "observation",
      "scenario": "A losing side block passes target, MTP and basic validation and is stored; no canonical mutation and no counter change.",
      "result": "STORED_NONCANONICAL",
      "commit_truth": "NOT_APPLICABLE",
      "canonical_counters": {
        "accepted_delta": "0",
        "rejected_delta": "0"
      }
    },
    {
      "id": "C01-REORG-001",
      "kind": "observation",
      "scenario": "A winning multi-block reorg is one plan: the whole transition is externally old or new and never row-wise intermediate.",
      "result": "ACCEPTED",
      "commit_truth": "NEW",
      "canonical_counters": {
        "accepted_delta": "+connect_count",
        "rejected_delta": "0"
      },
      "effects": {
        "external_visibility": "old_or_new",
        "final_state_fields": "tip_hash, height, cumulative_chainwork, utxo_digest, supply_digest",
        "intermediate_tip_rows": 0,
        "publication_events": 1,
        "summary_rows": "+connect_count"
      }
    },
    {
      "id": "C01-DISCONNECT-001",
      "kind": "observation",